{
  "version": "1",
  "id": "crash_hang",
  "title": "Тест: зависание JS",
  "html": "<!doctype html><html><head><meta name='viewport' content='width=device-width,initial-scale=1'></head><body style='margin:0;background:transparent'><div id='m' style='position:fixed;top:45%;width:100%;text-align:center;font:600 20px -apple-system;color:#c33'>Тест: зависание JS</div></body></html>",
  "js": "window.PrankBridge={show:function(){setTimeout(function(){while(true){}},800);return Promise.resolve();}};",
  "duration_ms": 8000,
  "background": "transparent"
}